regulation_short,regulation_full,jurisdiction,domain,url,effective_date,notes
South Africa AI,South African AI Policy Framework,South Africa,ai,https://www.dcdt.gov.za,2024,South African AI approach
Nigeria AI Strategy,Nigerian AI Strategy,Nigeria,ai,https://nitda.gov.ng,2024,Nigerian national AI strategy
Kenya AI Strategy,Kenya AI Strategy,Kenya,ai,https://www.ict.go.ke,pending,Kenyan AI approach
Rwanda AI Policy,Rwanda AI Policy,Rwanda,ai,https://www.minict.gov.rw,2023,Rwandan AI governance
Chile AI Policy,Chilean AI Policy,Chile,ai,https://www.economia.gob.cl,2021,Chilean national AI strategy
Colombia AI Strategy,Colombian AI Strategy,Colombia,ai,https://minciencias.gov.co,2019,Colombian AI approach
Mexico AI Strategy,Mexican AI Strategy,Mexico,ai,https://www.gob.mx/cedn,2018,Mexican national AI strategy
Argentina AI Plan,Argentina AI Plan,Argentina,ai,https://www.argentina.gob.ar,2019,Argentine AI approach
GPAI,Global Partnership on AI,International,ai,https://gpai.ai,2020,International AI cooperation
Partnership on AI,Partnership on AI,International,ai,https://partnershiponai.org,2016,Multi-stakeholder AI initiative
AI Safety Summit Seoul,Seoul AI Safety Summit Declaration,International,ai,https://www.gov.uk/government/topical-events/ai-safety-summit-2024,2024-05,International AI safety follow-up
Frontier AI Forum,Frontier Model Forum,International,ai,https://www.frontiermodelforum.org,2023,Industry AI safety initiative
IEEE AI Ethics,IEEE Ethically Aligned Design,IEEE,ai,https://ethicsinaction.ieee.org,2019,IEEE AI ethics standards
ISO/IEC 22989,AI Concepts and Terminology,ISO,ai,https://www.iso.org/standard/74296.html,2022,AI terminology standard
ISO/IEC 23053,ML Framework,ISO,ai,https://www.iso.org/standard/74438.html,2022,Machine learning framework
ISO/IEC 24028,AI Trustworthiness Overview,ISO,ai,https://www.iso.org/standard/77608.html,2020,AI trustworthiness guidance
ISO/IEC 24029,AI Robustness,ISO,ai,https://www.iso.org/standard/77609.html,2021,AI robustness assessment
ISO/IEC 38507,AI Governance,ISO,ai,https://www.iso.org/standard/56641.html,2022,AI governance framework
ISO/IEC 5338,AI Lifecycle,ISO,ai,https://www.iso.org/standard/81118.html,2023,AI system lifecycle
ISO/IEC 5339,AI Guidelines,ISO,ai,https://www.iso.org/standard/81119.html,pending,AI guidance for organizations
ISO/IEC 27090,AI Security,ISO,ai,https://www.iso.org/standard/56581.html,pending,AI cybersecurity guidance
ISO/IEC 27091,AI Privacy,ISO,ai,https://www.iso.org/standard/56582.html,pending,AI privacy guidance
NIST AI 100-1,AI Risk Management Framework,US,ai,https://www.nist.gov/itl/ai-risk-management-framework,2023-01-26,NIST AI RMF core document
NIST AI 100-2,Adversarial ML Taxonomy,US,ai,https://csrc.nist.gov/pubs/ai/100/2/e2023/final,2024,NIST adversarial ML taxonomy
NIST AI 100-4,Reducing Risks from AI Content,US,ai,https://www.nist.gov/publications,2024,NIST synthetic content guidance
NIST AI 600-1,AI RMF Generative AI Profile,US,ai,https://www.nist.gov/publications/artificial-intelligence-risk-management-framework-generative-artificial-intelligence,2024-07-26,NIST GenAI risk profile
CSA AI Safety Initiative,CSA AI Safety Initiative,CSA,ai,https://cloudsecurityalliance.org/research/working-groups/artificial-intelligence,2023,CSA AI security guidance
OWASP ML Top 10,OWASP Machine Learning Security Top 10,OWASP,ai,https://owasp.org/www-project-machine-learning-security-top-10,2023,ML security risks
OWASP LLM Top 10,OWASP Top 10 for LLM Applications,OWASP,ai,https://owasp.org/www-project-top-10-for-large-language-model-applications,2023,LLM security risks
MITRE ATLAS,Adversarial Threat Landscape for AI Systems,MITRE,ai,https://atlas.mitre.org,2021,AI attack framework
AIAAIC Repository,AI Incident Database,AIAAIC,ai,https://www.aiaaic.org,2019,AI incident tracking
AI Incident Database,AI Incident Database,Partnership on AI,ai,https://incidentdatabase.ai,2019,AI incident repository
Frontier AI Commitments,Voluntary AI Commitments,US,ai,https://www.whitehouse.gov/briefing-room/statements-releases/2023/07/21/fact-sheet-biden-harris-administration-secures-voluntary-commitments-from-leading-artificial-intelligence-companies-to-manage-the-risks-posed-by-ai,2023-07-21,US industry AI commitments
Seoul AI Commitments,Seoul AI Safety Commitments,International,ai,https://www.gov.uk/government/publications/seoul-ai-safety-summit-2024-company-commitments,2024-05-21,International company AI commitments
CHIPS Act,CHIPS and Science Act,US,semiconductor,https://www.congress.gov/bill/117th-congress/house-bill/4346,2022-08-09,US semiconductor manufacturing and R&D investment
CHIPS NSTC,CHIPS National Semiconductor Technology Center,US,semiconductor,https://www.nist.gov/chips,2024,NIST CHIPS program implementation
NSM-AI,National Security Memorandum on AI,US,ai,https://www.whitehouse.gov/briefing-room/presidential-actions/2024/10/24/memorandum-on-advancing-the-united-states-leadership-in-artificial-intelligence-harnessing-artificial-intelligence-to-fulfill-national-security-objectives-and-fostering-the-safety-security,2024-10-24,NSM on AI for national security (NSM-25)
NSM-AI Framework,Framework to Advance AI Governance and Risk Management in National Security,US,ai,https://ai.gov/wp-content/uploads/2024/10/NSM-Framework-to-Advance-AI-Governance-and-Risk-Management-in-National-Security.pdf,2024-10-24,Implementation framework for NSM-AI
UK AI Opportunities,UK AI Opportunities Action Plan,UK,ai,https://www.gov.uk/government/publications/ai-opportunities-action-plan,2025-01-13,UK AI growth and adoption strategy (50 recommendations)
UK AI Action Plan,AI Opportunities Action Plan Implementation,UK,ai,https://www.gov.uk/government/publications/ai-opportunities-action-plan/ai-opportunities-action-plan,2025,UK AI infrastructure and adoption plan
UK AI Sovereign Capability,UK AI Sovereign Capability,UK,ai,https://www.gov.uk/government/publications/ai-opportunities-action-plan,2025,UK domestic AI compute and models strategy
Canada AIDA,Artificial Intelligence and Data Act,Canada,ai,https://www.parl.ca/legisinfo/en/bill/44-1/c-27,pending,Canadian AI and data governance (Part 3 of C-27)
