regulation_short,regulation_full,jurisdiction,domain,url,effective_date,notes
Bahrain PDPL,Personal Data Protection Law,Bahrain,privacy,https://www.pdp.gov.bh,2019-08-01,Bahraini data protection (Law 30)
Kuwait DPL,Data Privacy Protection Regulation,Kuwait,privacy,https://citra.gov.kw,2021,Kuwaiti data protection
Oman PDPL,Personal Data Protection Law,Oman,privacy,https://mtc.gov.om,2022,Omani data protection
Jordan DPL,Data Protection Law,Jordan,privacy,https://www.moict.gov.jo,2023,Jordanian data protection (draft)
Pakistan PDPB,Personal Data Protection Bill,Pakistan,privacy,https://moitt.gov.pk,pending,Pakistani data protection (proposed)
Sri Lanka PDPA,Personal Data Protection Act,Sri Lanka,privacy,https://www.parliament.lk,2022-03-19,Sri Lankan data protection
Bangladesh DPA,Data Protection Act,Bangladesh,privacy,pending,pending,Bangladesh data protection (proposed)
Nepal Privacy Act,Privacy Act,Nepal,privacy,https://www.opmcm.gov.np,2018,Nepali privacy law
UN Cybercrime Convention,UN Convention against Cybercrime,UN,cybercrime,https://www.unodc.org/unodc/en/cybercrime/ad_hoc_committee/home,pending,International cybercrime treaty
Budapest Convention,Convention on Cybercrime,Council of Europe,cybercrime,https://www.coe.int/en/web/cybercrime/the-budapest-convention,2004-07-01,International cybercrime treaty
Tallinn Manual,Tallinn Manual on Cyber Operations,NATO CCDCOE,cybersecurity,https://ccdcoe.org/research/tallinn-manual,2017,International law applicable to cyber
GDPR Adequacy,GDPR Adequacy Decisions,EU,privacy,https://commission.europa.eu/law/law-topic/data-protection/international-dimension-data-protection/adequacy-decisions_en,varies,Countries with EU adequacy
EU-US DPF,EU-US Data Privacy Framework,EU-US,privacy,https://www.dataprivacyframework.gov,2023-07-10,Transatlantic data transfers
UK-US Data Bridge,UK Extension to EU-US DPF,UK-US,privacy,https://ico.org.uk/for-organisations/uk-gdpr-guidance-and-resources/international-transfers/uk-us-data-bridge,2023-10-12,UK-US data transfers
Swiss-US DPF,Swiss-US Data Privacy Framework,Swiss-US,privacy,https://www.dataprivacyframework.gov/s/article/Swiss-US-Data-Privacy-Framework-Program,2024-01,Swiss-US data transfers
AI Liability Directive,AI Liability Directive,EU,ai,https://ec.europa.eu/commission/presscorner/detail/en/ip_22_5807,pending,AI-specific liability rules
Colorado AI Act,Colorado AI Act,US-CO,ai,https://leg.colorado.gov/bills/sb24-205,2026-02-01,Colorado AI governance
NYC Local Law 144,NYC Automated Employment Decision Tools,US-NY,ai,https://rules.cityofnewyork.us/wp-content/uploads/2023/04/DCWP-NOA-for-Use-of-Automated-Employment-Decisionmaking-Tools-2.pdf,2023-07-05,NYC AI hiring bias audits
Illinois AI Video Interview Act,Artificial Intelligence Video Interview Act,US-IL,ai,https://www.ilga.gov/legislation/ilcs/ilcs3.asp?ActID=4015,2020-01-01,Illinois AI hiring disclosure
Utah AI Policy Act,Utah Artificial Intelligence Policy Act,US-UT,ai,https://le.utah.gov/~2024/bills/static/SB0149.html,2024-05-01,Utah AI disclosure requirements
California AI Bills,California AI Legislation Package,US-CA,ai,varies,varies,Multiple CA AI bills (SB 1047 vetoed etc.)
China AI Provisions,Interim Measures for Generative AI,China,ai,https://www.cac.gov.cn,2023-08-15,Chinese generative AI rules
China Algorithm Rules,Algorithm Recommendation Rules,China,ai,https://www.cac.gov.cn,2022-03-01,Chinese algorithm governance
China Deep Synthesis,Deep Synthesis Regulations,China,ai,https://www.cac.gov.cn,2023-01-10,Chinese deepfake rules
Japan AI Guidelines,AI Guidelines for Business,Japan,ai,https://www.meti.go.jp/english/policy/mono_info_service/information_economy/artificial_intelligence.html,2024,Japanese AI governance guidelines
Korea AI Act,AI Industry Development Act,South Korea,ai,pending,pending,Korean AI legislation (proposed)
Singapore AI Governance,Model AI Governance Framework,Singapore,ai,https://www.pdpc.gov.sg/help-and-resources/2020/01/model-ai-governance-framework,2020,Singapore AI guidelines
Brazil AI Bill,AI Regulation Bill,Brazil,ai,https://www.camara.leg.br/propostas-legislativas/2236340,pending,Brazilian AI regulation (PL 2338)
UK AI White Paper,Pro-Innovation Approach to AI Regulation,UK,ai,https://www.gov.uk/government/publications/ai-regulation-a-pro-innovation-approach,2023,UK AI regulatory principles
Bletchley Declaration,Bletchley Declaration on AI Safety,International,ai,https://www.gov.uk/government/publications/ai-safety-summit-2023-the-bletchley-declaration,2023-11-01,International AI safety declaration
G7 Hiroshima AI Process,G7 AI Principles,G7,ai,https://www.mofa.go.jp/ecm/ec/page5e_000076.html,2023-10-30,G7 AI governance principles
OECD AI Principles,OECD Principles on AI,OECD,ai,https://oecd.ai/en/ai-principles,2019-05-22,International AI principles
UNESCO AI Ethics,UNESCO Recommendation on Ethics of AI,UNESCO,ai,https://www.unesco.org/en/artificial-intelligence/recommendation-ethics,2021-11-23,International AI ethics framework
ISO/IEC 27001,Information Security Management System,ISO,cybersecurity,https://www.iso.org/standard/27001,2022,Information security standard
ISO/IEC 27701,Privacy Information Management,ISO,privacy,https://www.iso.org/standard/71670.html,2019,Privacy extension to 27001
ISO/IEC 42001,AI Management System,ISO,ai,https://www.iso.org/standard/81230.html,2023-12,AI management system standard
ISO/IEC 23894,AI Risk Management,ISO,ai,https://www.iso.org/standard/77304.html,2023,AI risk management guidance
SOC 2,Service Organization Control 2,AICPA,compliance,https://www.aicpa.org/resources/landing/system-and-organization-controls-soc-suite-of-services,2010,Service organization security
PCI DSS,Payment Card Industry Data Security Standard,PCI SSC,financial,https://www.pcisecuritystandards.org,2004,Payment card security (v4.0 2024)
SWIFT CSP,SWIFT Customer Security Programme,SWIFT,financial,https://www.swift.com/myswift/customer-security-programme-csp,2017,Financial messaging security
HITRUST CSF,HITRUST Common Security Framework,HITRUST,healthcare,https://hitrustalliance.net,2007,Healthcare security framework
TISAX,Trusted Information Security Assessment Exchange,VDA,automotive,https://www.enx.com/en-us/tisax,2017,Automotive supply chain security
IEC 62443,Industrial Cybersecurity Standards,IEC,industrial,https://www.iec.ch/cyber-security,varies,Industrial control system security
NIST AI RMF,AI Risk Management Framework,US,ai,https://www.nist.gov/itl/ai-risk-management-framework,2023-01-26,US AI risk management framework
NIST SP 800-53,Security and Privacy Controls,US,government,https://csrc.nist.gov/publications/detail/sp/800-53/rev-5/final,2020,Federal security controls (Rev 5)
NIST SP 800-171,Protecting CUI,US,government,https://csrc.nist.gov/publications/detail/sp/800-171/rev-2/final,2020,Controlled unclassified info protection
NIST SP 800-218,Secure Software Development Framework,US,government,https://csrc.nist.gov/publications/detail/sp/800-218/final,2022,Secure development practices
CIS Controls,CIS Critical Security Controls,CIS,cybersecurity,https://www.cisecurity.org/controls,2008,Security controls (v8.1)
COBIT,Control Objectives for IT,ISACA,governance,https://www.isaca.org/resources/cobit,1996,IT governance framework
ITIL,IT Infrastructure Library,Axelos,governance,https://www.axelos.com/best-practice-solutions/itil,1989,IT service management
CSA CCM,Cloud Controls Matrix,CSA,cloud,https://cloudsecurityalliance.org/research/cloud-controls-matrix,2010,Cloud security controls (v4)
CSA STAR,Security Trust Assurance and Risk,CSA,cloud,https://cloudsecurityalliance.org/star,2011,Cloud security certification
SOX Section 404,SOX IT Controls,US,financial,https://www.sec.gov/spotlight/sarbanes-oxley.htm,2002,IT controls for financial reporting
GLBA Safeguards,GLBA Safeguards Rule,US,financial,https://www.ftc.gov/legal-library/browse/rules/safeguards-rule,2003,Financial privacy safeguards
MAS TRM,Technology Risk Management Guidelines,Singapore,financial,https://www.mas.gov.sg/regulation/guidelines/technology-risk-management-guidelines,2021,Singapore financial technology risk
HKMA Cybersecurity,Cybersecurity Fortification Initiative,Hong Kong,financial,https://www.hkma.gov.uk/eng/key-functions/banking/banking-conduct-supervision/cybersecurity-fortification-initiative,2016,HK financial cybersecurity
APRA CPS 234,Information Security,Australia,financial,https://www.apra.gov.au/sites/default/files/cps_234_july_2019_for_public_release.pdf,2019-07-01,Australian financial security
OSFI B-13,Technology and Cyber Risk Management,Canada,financial,https://www.osfi-bsif.gc.ca/Eng/fi-if/rg-ro/gdn-ort/gl-ld/Pages/b13-dft.aspx,2022,Canadian financial technology risk
PRA SS1/21,Operational Resilience,UK,financial,https://www.bankofengland.co.uk/prudential-regulation/publication/2021/march/operational-resilience-policy-ss,2022-03-31,UK financial operational resilience
FCA SYSC,Senior Management Arrangements Systems and Controls,UK,financial,https://www.handbook.fca.org.uk/handbook/SYSC,2001,UK financial systems controls
Executive Order 14110,Safe Secure and Trustworthy AI,US,ai,https://www.whitehouse.gov/briefing-room/presidential-actions/2023/10/30/executive-order-on-the-safe-secure-and-trustworthy-development-and-use-of-artificial-intelligence,2023-10-30,Biden AI Executive Order
OMB M-24-10,Advancing Governance Innovation and Risk Management for Agency Use of AI,US,ai,https://www.whitehouse.gov/omb/briefing-room/2024/03/28/omb-releases-implementation-guidance-following-president-bidens-executive-order-on-artificial-intelligence,2024-03-28,Federal agency AI governance
OMB M-24-18,Advancing the Responsible Acquisition of AI in Government,US,ai,https://www.whitehouse.gov/omb/briefing-room/2024/10/03/advancing-the-responsible-acquisition-of-artificial-intelligence-in-government,2024-10-03,Federal AI procurement guidance
NAIRR,National AI Research Resource,US,ai,https://www.ai.gov/nairrtf,pending,National AI research infrastructure
AI Bill of Rights,Blueprint for an AI Bill of Rights,US,ai,https://www.whitehouse.gov/ostp/ai-bill-of-rights,2022-10-04,OSTP AI principles (non-binding)
Texas AI Advisory Council,Texas AI Advisory Council,US-TX,ai,https://gov.texas.gov/organization/disabilities/ai_advisory_council,2023,Texas state AI governance
Connecticut AI Task Force,Connecticut AI Task Force,US-CT,ai,https://portal.ct.gov/AG/Press-Releases/2024-Press-Releases/Attorney-General-Tong-Announces-Connecticut-Artificial-Intelligence-Task-Force,2024,Connecticut AI governance
California SB 1047,Safe and Secure Innovation for Frontier AI Models Act,US-CA,ai,https://leginfo.legislature.ca.gov/faces/billNavClient.xhtml?bill_id=202320240SB1047,vetoed,California frontier AI bill (vetoed)
California AB 2013,AI Training Data Transparency,US-CA,ai,https://leginfo.legislature.ca.gov/faces/billNavClient.xhtml?bill_id=202320240AB2013,2026-01-01,California AI training data disclosure
California AB 2885,Government AI Procurement,US-CA,ai,https://leginfo.legislature.ca.gov/faces/billNavClient.xhtml?bill_id=202320240AB2885,2025-01-01,California government AI use
California AB 2930,Automated Decision Tools,US-CA,ai,https://leginfo.legislature.ca.gov/faces/billNavClient.xhtml?bill_id=202320240AB2930,vetoed,California ADT regulation (vetoed)
California SB 942,AI Transparency Act,US-CA,ai,https://leginfo.legislature.ca.gov/faces/billNavClient.xhtml?bill_id=202320240SB942,2026-01-01,California AI content labeling
California AB 1836,Digital Replicas,US-CA,ai,https://leginfo.legislature.ca.gov/faces/billNavClient.xhtml?bill_id=202320240AB1836,2025-01-01,California deceased performer digital replicas
California AB 2602,Digital Replicas Contracts,US-CA,ai,https://leginfo.legislature.ca.gov/faces/billNavClient.xhtml?bill_id=202320240AB2602,2025-01-01,California performer digital replica contracts
Tennessee ELVIS Act,Ensuring Likeness Voice and Image Security Act,US-TN,ai,https://www.capitol.tn.gov/Bills/113/Bill/SB2096.pdf,2024-07-01,Tennessee AI voice/likeness protection
No AI FRAUD Act,No Artificial Intelligence Fake Replicas And Unauthorized Duplications Act,US,ai,pending,pending,Federal AI deepfake bill (proposed)
NO FAKES Act,Nurture Originals Foster Art and Keep Entertainment Safe Act,US,ai,pending,pending,Federal digital replica bill (proposed)
DEFIANCE Act,Disrupt Explicit Forged Images and Non-Consensual Edits Act,US,ai,pending,pending,Federal deepfake NCII bill (proposed)
TAKE IT DOWN Act,Tools to Address Known Exploitation by Immobilizing Technological Deepfakes on Websites and Networks,US,ai,pending,pending,Federal deepfake removal bill (proposed)
CREATE AI Act,CREATE AI Act,US,ai,pending,pending,Federal AI copyright clarification (proposed)
AI Foundation Model Transparency Act,AI Foundation Model Transparency Act,US,ai,pending,pending,Federal foundation model disclosure (proposed)
AI Labeling Act,AI Labeling Act of 2023,US,ai,pending,pending,Federal AI content labeling (proposed)
Algorithmic Accountability Act,Algorithmic Accountability Act,US,ai,pending,pending,Federal algorithmic impact assessment (proposed)
Federal AI Governance Report,Federal AI Use Case Inventory,US,ai,https://ai.gov/ai-use-cases,2023,Federal agency AI use reporting
DOD AI Principles,DoD AI Ethical Principles,US,ai,https://www.defense.gov/News/Releases/Release/Article/2091996/dod-adopts-ethical-principles-for-artificial-intelligence,2020-02-24,US military AI ethics
DOD RAI Strategy,DoD Responsible AI Strategy,US,ai,https://www.ai.mil/docs/RAI_Strategy_and_Implementation_Pathway.pdf,2022-06-22,US military responsible AI
DOD CDAO,Chief Digital and AI Office Policies,US,ai,https://www.ai.mil,varies,US military AI governance
IC AI Principles,Intelligence Community AI Principles,US,ai,https://www.dni.gov/index.php/features/2693-principles-of-artificial-intelligence-ethics-for-the-intelligence-community,2020-07,US intelligence AI ethics
FDA AI/ML SaMD,AI/ML-Based Software as Medical Device,US,ai,https://www.fda.gov/medical-devices/software-medical-device-samd/artificial-intelligence-and-machine-learning-software-medical-device,2021,FDA AI medical device framework
FDA AI Action Plan,FDA AI/ML Action Plan,US,ai,https://www.fda.gov/medical-devices/software-medical-device-samd/artificial-intelligence-and-machine-learning-aiml-enabled-medical-devices,2021-01,FDA AI regulatory approach
CMS AI Health Equity,CMS AI Health Equity Guidance,US,ai,https://www.cms.gov/newsroom/press-releases/cms-announces-rule-advance-health-equity-and-patient-safety,2024,Medicare AI discrimination rules
OCC Model Risk,OCC Model Risk Management,US,ai,https://www.occ.gov/publications-and-resources/publications/comptrollers-handbook/files/model-risk-management/index-model-risk-management.html,2011,Banking AI/ML model governance (SR 11-7)
Fed SR 11-7,Supervisory Guidance on Model Risk Management,US,ai,https://www.federalreserve.gov/supervisionreg/srletters/sr1107.htm,2011-04-04,Federal Reserve AI/ML model risk
CFPB AI Guidance,CFPB Circular on Adverse Action and AI,US,ai,https://www.consumerfinance.gov/compliance/circulars/circular-2022-03-adverse-action-notification-requirements-in-connection-with-credit-decisions-based-on-complex-algorithms,2022-05-26,Consumer credit AI explainability
EEOC AI Guidance,EEOC AI and Algorithmic Fairness Initiative,US,ai,https://www.eeoc.gov/ai,2021,Employment discrimination and AI
FTC AI Enforcement,FTC AI and Algorithms Enforcement,US,ai,https://www.ftc.gov/business-guidance/blog/2023/02/keep-your-ai-claims-check,varies,FTC AI enforcement policy
HHS AI Strategy,HHS AI Strategy,US,ai,https://www.hhs.gov/about/agencies/asa/ocio/ai,2024,Health and Human Services AI
DHS AI Roadmap,DHS AI Roadmap,US,ai,https://www.dhs.gov/ai,2024,Homeland Security AI governance
DOE AI Principles,DOE AI Advancement Council,US,ai,https://www.energy.gov/artificial-intelligence-technology-office,2024,Department of Energy AI
DOT AV Policy,Automated Vehicles Comprehensive Plan,US,ai,https://www.transportation.gov/AV,varies,US autonomous vehicle policy
NHTSA ADS Framework,ADS Framework for Safety,US,ai,https://www.nhtsa.gov/technology-innovation/automated-vehicles-safety,varies,Autonomous driving safety framework
FAA UAS Integration,FAA UAS Integration,US,ai,https://www.faa.gov/uas,varies,Drone and autonomous aircraft rules
EU AI Act Annex I,EU AI Act High-Risk AI Systems,EU,ai,https://artificialintelligenceact.eu/annex/1,2024-08-01,High-risk AI classification
EU AI Act Annex III,EU AI Act High-Risk Use Cases,EU,ai,https://artificialintelligenceact.eu/annex/3,2024-08-01,High-risk AI use case list
EU AI Act Annex IV,EU AI Act Technical Documentation,EU,ai,https://artificialintelligenceact.eu/annex/4,2024-08-01,AI technical documentation requirements
EU AI Office,EU AI Office Guidelines,EU,ai,https://digital-strategy.ec.europa.eu/en/policies/ai-office,2024,EU AI Act implementation body
GPAI Code of Practice,General Purpose AI Code of Practice,EU,ai,https://digital-strategy.ec.europa.eu/en/policies/ai-office,2025,EU GPAI model rules
AI Pact,EU AI Pact,EU,ai,https://digital-strategy.ec.europa.eu/en/policies/ai-pact,2024,Voluntary EU AI Act early adoption
HLEG AI Ethics,High-Level Expert Group AI Ethics Guidelines,EU,ai,https://digital-strategy.ec.europa.eu/en/library/ethics-guidelines-trustworthy-ai,2019-04-08,EU trustworthy AI guidelines
ALTAI,Assessment List for Trustworthy AI,EU,ai,https://digital-strategy.ec.europa.eu/en/library/assessment-list-trustworthy-artificial-intelligence-altai-self-assessment,2020-07-17,EU AI self-assessment tool
EU AI Liability Proposal,AI Liability Directive Proposal,EU,ai,https://ec.europa.eu/commission/presscorner/detail/en/ip_22_5807,pending,AI-specific liability rules
ENISA AI Threat Landscape,ENISA AI Cybersecurity,EU,ai,https://www.enisa.europa.eu/topics/ai,varies,EU AI security guidance
EBA ML Guidelines,EBA Guidelines on ML for IRB,EU,ai,https://www.eba.europa.eu/activities/single-rulebook/regulatory-activities/credit-risk/guidelines-use-machine-learning-irb,2024,EU banking AI/ML guidance
ESMA AI Guidelines,ESMA AI in Investment Services,EU,ai,https://www.esma.europa.eu/press-news/esma-news/esma-consults-guidelines-use-ai-investment-services,2024,EU securities AI guidance
EIOPA AI Governance,EIOPA AI Governance Principles,EU,ai,https://www.eiopa.europa.eu/browse/digitalisation-and-financial-innovation/artificial-intelligence_en,varies,EU insurance AI guidance
ECB AI Guidance,ECB AI and ML in Banking Supervision,EU,ai,https://www.bankingsupervision.europa.eu/press/publications/newsletter/2024/html/ssm.nl240214.en.html,2024,ECB banking AI supervision
UK AISI,UK AI Safety Institute,UK,ai,https://www.gov.uk/government/organisations/ai-safety-institute,2023-11,UK AI safety research
UK AI Regulation Bill,UK AI Regulation Bill,UK,ai,pending,pending,UK AI legislation (proposed)
UK AI Standards Hub,UK AI Standards Hub,UK,ai,https://aistandardshub.org,2022,UK AI standards coordination
ICO AI Guidance,ICO AI and Data Protection,UK,ai,https://ico.org.uk/for-organisations/uk-gdpr-guidance-and-resources/artificial-intelligence,varies,UK data protection and AI
FCA AI Guidance,FCA AI and Machine Learning,UK,ai,https://www.fca.org.uk/firms/artificial-intelligence-machine-learning,varies,UK financial AI guidance
PRA AI Model Risk,PRA Model Risk Management for AI,UK,ai,https://www.bankofengland.co.uk/prudential-regulation/publication/2024/may/model-risk-management-principles-for-banks-ss,2024,UK banking AI model risk
UK Competition AI,CMA AI Foundation Models Review,UK,ai,https://www.gov.uk/cma-cases/ai-foundation-models-initial-review,2023,UK competition and AI
CDEI AI Assurance,CDEI AI Assurance Guide,UK,ai,https://www.gov.uk/government/publications/introduction-to-ai-assurance,2021,UK AI assurance framework
Alan Turing Institute AI,Turing AI Ethics,UK,ai,https://www.turing.ac.uk/research/research-programmes/public-policy,varies,UK AI research guidance
Germany AI Strategy,German AI Strategy,Germany,ai,https://www.ki-strategie-deutschland.de/home.html,2018,German national AI strategy (updated 2020)
France AI Strategy,French AI Strategy,France,ai,https://www.economie.gouv.fr/france-2030/strategie-nationale-intelligence-artificielle,2018,French national AI strategy
Italy AI Strategy,Italian AI Strategy,Italy,ai,https://www.governo.it/it/approfondimento/strategia-italiana-lintelligenza-artificiale/16147,2024,Italian national AI strategy
Spain AI Strategy,Spanish AI Strategy (ENIA),Spain,ai,https://portal.mineco.gob.es/en-us/ministerio/estrategias/Pages/ENIA.aspx,2020,Spanish national AI strategy
Netherlands AI Strategy,Dutch AI Strategy (SAPAI),Netherlands,ai,https://www.government.nl/topics/artificial-intelligence-ai,2019,Dutch AI strategy
Canada AI Strategy,Pan-Canadian AI Strategy,Canada,ai,https://ised-isde.canada.ca/site/ai-strategy/en,2017,Canadian national AI strategy
Canada AI Directive,Directive on Automated Decision-Making,Canada,ai,https://www.tbs-sct.canada.ca/pol/doc-eng.aspx?id=32592,2019-04-01,Canadian federal AI use
Canada OSFI AI,OSFI AI/ML Guidance,Canada,ai,https://www.osfi-bsif.gc.ca,2024,Canadian banking AI guidance
Canada C-27,Digital Charter Implementation Act,Canada,ai,https://www.parl.ca/legisinfo/en/bill/44-1/c-27,pending,Canadian AI and privacy bill
Quebec Bill 64 AI,Quebec AI Provisions,Canada-QC,ai,https://www.legisquebec.gouv.qc.ca,2023,Quebec automated decision rules
Australia AI Ethics,Australian AI Ethics Framework,Australia,ai,https://www.industry.gov.au/publications/australias-artificial-intelligence-ethics-framework,2019,Australian voluntary AI principles
Australia AI Action Plan,Australian AI Action Plan,Australia,ai,https://www.industry.gov.au/publications/australias-ai-action-plan,2021,Australian AI strategy
Australia AI in Government,Australian Government AI Policy,Australia,ai,https://www.digital.gov.au/policies/ai,2024,Australian federal AI use
APRA AI Guidance,APRA AI Governance,Australia,ai,https://www.apra.gov.au,2024,Australian financial AI guidance
NZ AI Strategy,New Zealand AI Strategy,New Zealand,ai,https://www.digital.govt.nz/digital-government/programmes-and-projects/artificial-intelligence,2024,NZ government AI approach
NZ Algorithm Charter,NZ Algorithm Charter,New Zealand,ai,https://data.govt.nz/toolkit/data-ethics/government-algorithm-transparency-and-accountability/algorithm-charter,2020,NZ government algorithm transparency
Japan AI Strategy,AI Strategy 2022,Japan,ai,https://www8.cao.go.jp/cstp/ai/index.html,2022,Japanese national AI strategy
Japan GPAI,Japan GPAI Guidelines,Japan,ai,https://www.meti.go.jp/english/policy/mono_info_service/information_economy/artificial_intelligence.html,2024,Japanese generative AI guidelines
METI AI Governance,METI AI Governance Guidelines,Japan,ai,https://www.meti.go.jp/shingikai/mono_info_service/ai_shakai_jisso/index.html,2022,Japanese corporate AI governance
Japan FSA AI,FSA AI Guidelines for Finance,Japan,ai,https://www.fsa.go.jp,2024,Japanese financial AI guidance
Korea AI Ethics,Korean AI Ethics Standards,South Korea,ai,https://www.msit.go.kr,2020,Korean AI ethics framework
Korea AI TK,Korean AI Trust and Safety Framework,South Korea,ai,https://www.pipc.go.kr,2023,Korean AI safety standards
PIPC AI Guidance,Korean AI Data Protection Guidance,South Korea,ai,https://www.pipc.go.kr/eng/user/lgp/law/lawDetail.do,2024,Korean AI and privacy
China AI Governance,China AI Governance Principles,China,ai,https://www.most.gov.cn,2019,Chinese AI ethics principles
China AIGC Rules,Measures for Generative AI Services,China,ai,https://www.cac.gov.cn/2023-07/13/c_1690898327029107.htm,2023-08-15,Chinese generative AI rules
China TC260 AI,TC260 AI Security Standards,China,ai,https://www.tc260.org.cn,varies,Chinese AI security standards
China AI Safety,AI Safety Governance Framework,China,ai,https://www.cac.gov.cn,2024,Chinese AI safety requirements
China Model Filing,Large Model Registration,China,ai,https://www.cac.gov.cn,2023,Chinese LLM registration requirement
Singapore FEAT,FEAT Principles for Finance AI,Singapore,ai,https://www.mas.gov.sg/publications/monographs-or-information-paper/2018/feat,2018,Singapore financial AI fairness
Singapore AI Verify,AI Verify Governance Framework,Singapore,ai,https://aiverifyfoundation.sg,2022,Singapore AI testing framework
Singapore IMDA AI,IMDA AI Governance,Singapore,ai,https://www.imda.gov.sg/how-we-can-help/ai-governance,varies,Singapore AI governance model
India AI Strategy,National AI Strategy,India,ai,https://www.niti.gov.in/national-strategy-artificial-intelligence,2018,Indian national AI strategy
India AI Mission,IndiaAI Mission,India,ai,https://indiaai.gov.in,2024,Indian AI development program
India DPDP AI,DPDP Act AI Provisions,India,ai,https://www.meity.gov.in,2023,Indian AI and data protection
MeitY AI Framework,MeitY Responsible AI Framework,India,ai,https://www.meity.gov.in/artificial-intelligence,2021,Indian responsible AI approach
RBI AI Guidelines,RBI AI and ML Governance,India,ai,https://www.rbi.org.in,2024,Indian banking AI guidance
Brazil AI Strategy,Brazilian AI Strategy,Brazil,ai,https://www.gov.br/mcti/pt-br/acompanhe-o-mcti/transformacaodigital/inteligenciaartificial,2021,Brazilian national AI strategy
ANPD AI Guidance,ANPD AI and Data Protection,Brazil,ai,https://www.gov.br/anpd/pt-br,2024,Brazilian AI and privacy
UAE AI Strategy,UAE AI Strategy 2031,UAE,ai,https://ai.gov.ae,2017,UAE national AI strategy
UAE AI Ethics,UAE AI Ethics Guidelines,UAE,ai,https://ai.gov.ae/ai-ethics,2019,UAE AI ethics principles
Saudi AI Strategy,Saudi National AI Strategy,Saudi Arabia,ai,https://sdaia.gov.sa,2020,Saudi AI strategy
SDAIA AI Ethics,SDAIA AI Ethics Principles,Saudi Arabia,ai,https://sdaia.gov.sa/en/SDAIA/about/Pages/Principles.aspx,2023,Saudi AI ethics
Israel AI Strategy,Israeli AI Policy,Israel,ai,https://innovationisrael.org.il,2023,Israeli national AI approach
